Código,Descrição
EM13CO16,"Desenvolver  projetos com robótica,  utilizando artefatos físicos ou  simuladores."
EM13CO01,Explorar e  construir a solução de  problemas por meio da  reutilização de partes de  soluções existentes.
EM13CO03,"Identificar o  comportamento dos  algoritmos no que diz  respeito ao consumo de  recursos como tempo,  memória e energia."
EM13CO02,"Explorar e  construir a solução de  problemas por meio de  refinamentos, utilizando  diversos níveis de abstração  desde a especificação até a  implementação."
EM13CO06,Avaliar software  levando em consideração  diferentes características e  métricas associadas.
EM13CO10,Conhecer os  fundamentos da Inteligência
EM13CO12,"Produzir, analisar,  gerir e compartilhar  informações a   partir de dados, utilizando  princípios de ciência de dados."
EM13CO13,Analisar e utilizar  as diferentes formas de  representação e consulta a  dados em formato digital para  pesquisas científicas.
EM13CO21,"Comunicar ideias  complexas de forma clara por  meio de objetos digitais como  mapas conceituais, infográficos,  hipertextos e outros"
EM13CO03,"Identificar o  comportamento dos algoritmos  no que diz respeito ao consumo  de recursos como tempo,  memória e energia."
EM13CO11,"Criar e explorar  modelos computacionais  ✔ Escolher, entre diferentes tipos de gráficos  estatísticos, aquele mais adequado para  representar uma característica desejada do  conjunto de dados, por exemplo, entre as notas  dos estudantes de uma sala de aula (nota mais  frequente, variação das notas, comparação entre  notas de diferentes grupos etc.).  ✔ Relatar as principais vantagens/desvantagens do  uso de tabletes e gráficos estatísticos obtidos de  reportagens e/ou sites de referências que  mostrem ações para uma vida mais saudável  • Gráficos e diagramas estatísticos:  histogramas, polígonos de frequências,  diagrama de caixa, ramos e folhas etc.  • Medidas de tendência central e medidas de  dispersão."
EM13CO18,"Planejar e  gerenciar projetos integrados  às áreas de conhecimento de  forma colaborativa,  solucionando problemas com  artefatos computacionais."
EM13CO01,- Explorar e  construir a solução de  problemas por meio da  reutilização de partes de  soluções existentes.
EM13CO08,"- Entender  como mudanças na  tecnologia afetam a  segurança, incluindo novas  maneiras de preservar sua  privacidade e dados  pessoais on -line,  reportando suspeitas e  buscando ajuda em  situações de risco."
EM13CO11,"- Criar e  explorar modelos  computacionais simples  para simular e fazer  previsões, identificando sua  importância no  desenvolvimento científico."
EM13CO09,"- Identificar  tecnologias digitais, sua  presença e formas de uso,  nas diferentes atividades no  mundo do trabalho."
EM13CO08,- Conhecer  os fundamentos da
EM13CO08,"- Entender  como mudanças na  tecnologia afetam a  segurança, incluindo  novas maneiras de  preservar sua privacidade  e dados pessoais on -line,  reportando suspeitas e  buscando ajuda em  situações de risco."
EM13CO02,"- Explorar e  construir a solução de  problemas por meio de  refinamentos, utilizando  diversos níveis de  abstração desde a  especificação até a  implementação."
